{
  "id": "step-3.5-flash",
  "vendor": "stepfun",
  "family": "step",
  "context_window_tokens": 262144,
  "max_output_tokens": 65536,
  "recommended_temperature": 1.0,
  "supports_thinking": true,
  "aliases": [
    "stepfun/Step-3.5-Flash"
  ],
  "attachments": {
    "images": false,
    "audio": false,
    "video": false,
    "documents": false
  },
  "reasoning_levels": [
    "low",
    "medium",
    "high"
  ],
  "default_reasoning_effort": "medium",
  "sources": {
    "context_window_tokens": {
      "url": "https://platform.stepfun.com/",
      "verified_at": "2026-07-14",
      "note": "from official platform docs"
    },
    "reasoning_levels": {
      "url": "https://platform.stepfun.ai/docs/en/api-reference/chat/chat-completion-create",
      "verified_at": "2026-07-24",
      "note": "StepFun Chat Completions API: reasoning_effort low/medium/high for three-tier models; default medium."
    },
    "default_reasoning_effort": {
      "url": "https://platform.stepfun.ai/docs/en/api-reference/chat/chat-completion-create",
      "verified_at": "2026-07-24",
      "note": "StepFun Chat Completions API: reasoning_effort low/medium/high for three-tier models; default medium."
    }
  }
}
