{
  "id": "mimo-v2.5-pro",
  "vendor": "xiaomi",
  "family": "mimo",
  "context_window_tokens": 1048576,
  "max_output_tokens": 131072,
  "recommended_temperature": 1.0,
  "supports_thinking": true,
  "attachments": {
    "images": true,
    "documents": true,
    "audio": false,
    "video": false
  },
  "aliases": [
    "xiaomi/mimo-v2.5-pro"
  ],
  "reasoning_levels": [
    "none",
    "low",
    "medium",
    "high"
  ],
  "default_reasoning_effort": "none",
  "sources": {
    "context_window_tokens": {
      "url": "https://token-plan-sgp.xiaomimimo.com/anthropic",
      "verified_at": "2026-07-14",
      "note": "from official docs"
    },
    "reasoning_levels": {
      "url": "https://mimo.mi.com/docs/en-US/api/chat/responses",
      "verified_at": "2026-07-24",
      "note": "MiMo Responses API docs: reasoning.effort values none/low/medium/high; none disables thinking."
    },
    "default_reasoning_effort": {
      "url": "https://mimo.mi.com/docs/en-US/api/chat/responses",
      "verified_at": "2026-07-24",
      "note": "MiMo Responses API docs: reasoning.effort values none/low/medium/high; none disables thinking."
    }
  }
}
