{
  "id": "m2-her",
  "vendor": "minimax",
  "family": "minimax",
  "context_window_tokens": 64000,
  "supports_thinking": false,
  "attachments": {
    "images": false,
    "audio": false,
    "video": false,
    "documents": false
  },
  "aliases": [
    "minimax/m2-her"
  ],
  "sources": {
    "context_window_tokens": {
      "url": "https://platform.minimax.io/docs/guides/text-chat",
      "verified_at": "2026-09-22",
      "note": "Vendor Supported Models table: M2-her context window 64 K; replaces prior Novita aggregator value (32000)"
    }
  }
}
