{
  "id": "qwen2.5-coder-32b-instruct",
  "vendor": "nvidia",
  "family": "qwen",
  "context_window_tokens": 131072,
  "max_output_tokens": 8192,
  "recommended_temperature": 0.7,
  "supports_thinking": false,
  "aliases": [
    "qwen/qwen2.5-coder-32b-instruct"
  ],
  "sources": {
    "context_window_tokens": {
      "url": "https://github.com/QwenLM/Qwen2.5-Coder",
      "verified_at": "2026-07-14",
      "note": "Official Qwen2.5-Coder repository."
    }
  },
  "attachments": {
    "images": false,
    "audio": false,
    "video": false,
    "documents": false
  }
}
