{
  "id": "deepseek-v3-0324",
  "vendor": "deepseek",
  "family": "deepseek",
  "context_window_tokens": 163840,
  "supports_thinking": false,
  "attachments": {
    "images": false,
    "audio": false,
    "video": false,
    "documents": false
  },
  "aliases": [
    "deepseek/deepseek-v3-0324"
  ],
  "sources": {
    "context_window_tokens": {
      "url": "https://api.novita.ai/openai/v1/models",
      "verified_at": "2026-07-31",
      "note": "Novita AI /models API for deepseek/deepseek-v3-0324"
    },
    "max_output_tokens": {
      "url": "https://api.novita.ai/openai/v1/models",
      "verified_at": "2026-07-31",
      "note": "Novita AI /models API for deepseek/deepseek-v3-0324"
    }
  },
  "max_output_tokens": 65536
}
