{
  "id": "granite-3.0-3b-a800m-instruct",
  "vendor": "ibm",
  "family": "granite",
  "context_window_tokens": 4096,
  "attachments": {
    "images": false,
    "audio": false,
    "video": false,
    "documents": false
  },
  "sources": {
    "context_window_tokens": {
      "url": "https://huggingface.co/ibm-granite/granite-3.0-3b-a800m-instruct"
    }
  },
  "aliases": [
    "ibm/granite-3.0-3b-a800m-instruct"
  ]
}
