{
  "id": "gpt-5.2",
  "vendor": "openai",
  "family": "gpt",
  "context_window_tokens": 400000,
  "max_output_tokens": 128000,
  "recommended_temperature": 1.0,
  "supports_thinking": true,
  "attachments": {
    "images": true,
    "documents": true
  },
  "sources": {
    "attachments": {
      "url": "https://openrouter.ai/api/v1/models/openai/gpt-5.2",
      "verified_at": "2026-07-14",
      "note": "auto-filled by probe from OpenRouter /api/v1/models"
    }
  }
}
