{
  "id": "claude-sonnet-4",
  "vendor": "anthropic",
  "family": "claude",
  "context_window_tokens": 200000,
  "max_output_tokens": 64000,
  "recommended_temperature": 1.0,
  "supports_thinking": true,
  "attachments": {
    "images": true,
    "documents": true
  },
  "aliases": [
    "anthropic/claude-sonnet-4"
  ],
  "sources": {
    "context_window_tokens": {
      "url": "https://docs.anthropic.com/en/docs/about-claude/models",
      "verified_at": "2026-07-14",
      "note": "from official docs"
    },
    "max_output_tokens": {
      "url": "https://docs.anthropic.com/en/docs/about-claude/models",
      "verified_at": "2026-07-14",
      "note": "from official docs"
    },
    "reasoning_levels": {
      "url": "https://openrouter.ai/api/v1/models/anthropic/claude-sonnet-4",
      "verified_at": "2026-07-23",
      "note": "auto-filled from OpenRouter /api/v1/models"
    },
    "default_reasoning_effort": {
      "url": "https://openrouter.ai/api/v1/models/anthropic/claude-sonnet-4",
      "verified_at": "2026-07-23",
      "note": "auto-filled from OpenRouter /api/v1/models"
    }
  }
}
