{
  "id": "gpt-5.4-mini",
  "vendor": "openai",
  "family": "gpt",
  "context_window_tokens": 400000,
  "max_output_tokens": 128000,
  "recommended_temperature": 1.0,
  "supports_thinking": true,
  "attachments": {
    "images": true,
    "audio": true,
    "video": false,
    "documents": true
  },
  "sources": {
    "attachments": {
      "url": "https://openrouter.ai/api/v1/models/openai/gpt-5.4-mini",
      "verified_at": "2026-07-14",
      "note": "auto-filled by probe from OpenRouter /api/v1/models"
    },
    "context_window_tokens": {
      "url": "https://platform.openai.com/docs/models",
      "verified_at": "2026-07-14",
      "note": "verified context window from official documentation"
    },
    "max_output_tokens": {
      "url": "https://platform.openai.com/docs/models",
      "verified_at": "2026-07-14",
      "note": "verified output token limit from official documentation"
    }
  },
  "reasoning_levels": [
    "low",
    "medium",
    "high"
  ],
  "default_reasoning_effort": "medium"
}
