{
  "id": "mistral-medium-3.1",
  "vendor": "mistral",
  "family": "mistral",
  "context_window_tokens": 131072,
  "recommended_temperature": 1.0,
  "supports_thinking": true,
  "attachments": {
    "images": false,
    "audio": false,
    "video": false,
    "documents": false
  },
  "sources": {
    "context_window_tokens": {
      "url": "https://openrouter.ai/api/v1/models/mistralai/mistral-medium-3.1",
      "verified_at": "2026-07-24",
      "note": "from OpenRouter /api/v1/models"
    }
  },
  "aliases": [
    "mistralai/mistral-medium-3.1"
  ]
}
