{
  "id": "grok-3-mini",
  "vendor": "xai",
  "family": "grok",
  "context_window_tokens": 131072,
  "max_output_tokens": 16384,
  "recommended_temperature": 1.0,
  "supports_thinking": true,
  "attachments": {
    "images": true,
    "audio": false,
    "video": false,
    "documents": false
  },
  "reasoning_levels": [
    "low",
    "high"
  ],
  "default_reasoning_effort": "high",
  "sources": {
    "context_window_tokens": {
      "url": "https://docs.x.ai/api/models",
      "verified_at": "2026-07-14",
      "note": "from official docs"
    }
  }
}
