{
  "id": "o1",
  "vendor": "openai",
  "family": "o1",
  "context_window_tokens": 200000,
  "max_output_tokens": 100000,
  "recommended_temperature": 1.0,
  "supports_thinking": true,
  "attachments": {
    "images": true,
    "audio": false,
    "video": false,
    "documents": false
  },
  "reasoning_levels": [
    "low",
    "medium",
    "high"
  ],
  "default_reasoning_effort": "medium",
  "sources": {
    "attachments": {
      "url": "https://openrouter.ai/api/v1/models/openai/o1",
      "verified_at": "2026-07-14",
      "note": "auto-filled by probe from OpenRouter /api/v1/models"
    },
    "context_window_tokens": {
      "url": "https://platform.openai.com/docs/models",
      "verified_at": "2026-07-14",
      "note": "verified context window of 200k from official documentation"
    },
    "max_output_tokens": {
      "url": "https://platform.openai.com/docs/models",
      "verified_at": "2026-07-14",
      "note": "verified output token limit of 100k (including reasoning tokens)"
    },
    "reasoning_levels": {
      "url": "https://raw.githubusercontent.com/openai/openai-openapi/refs/heads/manual_spec/openapi.yaml",
      "verified_at": "2026-07-24",
      "note": "OpenAI API ReasoningEffort schema (o-series only): values low/medium/high, default medium."
    },
    "default_reasoning_effort": {
      "url": "https://raw.githubusercontent.com/openai/openai-openapi/refs/heads/manual_spec/openapi.yaml",
      "verified_at": "2026-07-24",
      "note": "OpenAI API ReasoningEffort schema (o-series only): values low/medium/high, default medium."
    }
  }
}
