{
  "id": "o4-mini-high",
  "vendor": "openai",
  "family": "o",
  "context_window_tokens": 200000,
  "max_output_tokens": 100000,
  "recommended_temperature": 1.0,
  "supports_thinking": true,
  "attachments": {
    "images": true,
    "audio": false,
    "video": false,
    "documents": false
  },
  "sources": {
    "context_window_tokens": {
      "url": "https://openrouter.ai/api/v1/models/openai/o4-mini-high",
      "verified_at": "2026-07-24",
      "note": "from OpenRouter /api/v1/models"
    },
    "max_output_tokens": {
      "url": "https://openrouter.ai/api/v1/models/openai/o4-mini-high",
      "verified_at": "2026-07-24",
      "note": "from OpenRouter /api/v1/models"
    }
  },
  "aliases": [
    "openai/o4-mini-high"
  ]
}
