{
  "id": "kimi-thinking-preview",
  "vendor": "moonshot",
  "family": "kimi",
  "context_window_tokens": 128000,
  "max_output_tokens": 65536,
  "recommended_temperature": 1.0,
  "supports_thinking": true,
  "attachments": {
    "images": true,
    "audio": false,
    "video": false,
    "documents": true
  },
  "sources": {
    "context_window_tokens": {
      "url": "https://platform.moonshot.cn/",
      "verified_at": "2026-07-14",
      "note": "from official docs"
    }
  },
  "reasoning_levels": [
    "low",
    "medium",
    "high"
  ],
  "default_reasoning_effort": "medium"
}
