{
  "id": "llama-3.2-3b-instruct",
  "vendor": "local",
  "family": "llama",
  "context_window_tokens": 131072,
  "max_output_tokens": 8192,
  "recommended_temperature": 0.7,
  "supports_thinking": false,
  "attachments": {
    "images": false,
    "audio": false,
    "video": false,
    "documents": false
  },
  "sources": {
    "context_window_tokens": {
      "url": "https://github.com/meta-llama/llama-models/blob/main/models/llama3_2/MODEL_CARD.md",
      "verified_at": "2026-07-14",
      "note": "from Meta's official model card"
    }
  }
}
